{
  "schema_version": "1.0.0",
  "consent_id": "consent_spk_b",
  "subject": {
    "type": "synthetic",
    "speaker_id": "spk_b",
    "description": "Voice generated by a text-to-speech model. No person is recorded."
  },
  "status": "active",
  "granted_at": "2026-01-01T00:00:00Z",
  "permitted_uses": [
    "training",
    "evaluation",
    "analytics",
    "generation",
    "redistribution"
  ],
  "license": {
    "identifier": "MIT"
  },
  "evidence": {
    "kind": "not-applicable-synthetic",
    "reference": "testdata/synthetic-speech/README.md"
  }
}
